offer_id,name,rung,target_personas,promise,deliverables,trust_note,price_band_sar_low,price_band_sar_high,cycle,upgrade_path,channels,proof_required,owner,status
OFF-01,Free Sample / Diagnostic,1,P-CRO; Pipeline-Starved,1-3 day diagnostic on one revenue question,Diagnostic one-pager AR+EN; pipeline-health snapshot,No customer data leaves engagement scope; no external outreach,0,0,1-3 days,Revenue Sprint,LinkedIn; Warm intro,Previous anonymised diagnostic,founder,active
OFF-02,Revenue Sprint,2,P-CRO; P-Founder-Agency; P-Implementer,7-day Sprint: diagnostic + draft pack + proof pack,Source Passport; DQ score; account scoring; 10 founder-approved drafts; bilingual proof pack,Drafts only; nothing leaves without founder approval,499,4999,7 days,Managed Pilot OR Revenue Desk,LinkedIn; warm intro; email,Sector-relevant sample,founder,active
OFF-03,Managed Pilot,3,P-CRO; P-Cyber-SalesDirector,30-day managed pilot of one revenue motion,Approved sequence; scored account list; weekly drafts; monthly pipeline report,All outbound founder-approved; customer keeps kill switch,5000,14999,30 days,Revenue Desk Retainer,Founder call + proposal,Sprint delivered,founder,active
OFF-04,Revenue Desk Retainer,4,P-CRO; P-CEO-MidMarket,Monthly Revenue Desk operated for the customer,Monthly account scoring refresh; 30+ drafts/month; weekly approval queue; monthly pipeline report,Founder-approved outbound only; customer kill switch,5000,25000,Monthly 3-month min,Founder Console / Command Center,Customer review + LinkedIn,Pilot delivered,founder,active
OFF-05,Founder Console / Command Center,5,P-CEO-MidMarket; P-Founder,Single founder operating pane across the company,Live console + monthly operating cadence + co-located founder reviews,Customer owns kill switch; Dealix operates within scope,15000,40000,Monthly 6-month min,Enterprise Revenue Intelligence OS,Co-located founder review,90+ days of Retainer,founder,active
OFF-06,Enterprise Revenue Intelligence OS,6,Enterprise CEO + CRO,Custom revenue intelligence operating system,Scoped per engagement,Multi-party governance; founder + customer-executive co-sign,50000,,Per quarter,Renewal,Direct executive engagement,2 retainers in sector,founder,active
OFF-07,Partner / White-label,7,P-Founder-Agency; P-Implementer,Reseller / white-label arrangement,Partner kit; training; co-delivery cadence,Partner bound by Dealix brand verifier and trust gates,,,Revenue share 10-25%,Renewal,Partner network,Sprint delivered + partner-fit case,founder,active
