idea_id,topic,theme,format,proof_required,owner,score,status,source
ci-001,Why we count cash and not pipeline,From Leads to Cash,linkedin_founder,no,founder,0.85,backlog,fallback
ci-002,Three KSA sectors moving the fastest,Driven by Growth,sector_report,yes,content_strategist,0.78,backlog,fallback
ci-003,The trust gates inside Dealix,Built on Trust,linkedin_dealix,no,brand_guardian,0.82,backlog,fallback
ci-004,One founder lesson from a lost deal,Real Growth without Hype,linkedin_founder,no,founder,0.74,backlog,fallback
ci-005,Why we draft 100 messages and send 12,AI with Approval,linkedin_founder,no,founder,0.81,backlog,fallback
ci-006,How a Riyadh cybersecurity team broke its outbound plateau,Driven by Growth,case_study,yes,content_strategist,0.92,backlog,fallback
ci-007,Bilingual cadence: what changes between AR and EN,Global Mindset Local Impact,linkedin_dealix,no,content_strategist,0.71,backlog,fallback
ci-008,Cash collected vs. pipeline promised,From Leads to Cash,newsletter,no,founder,0.79,backlog,fallback
